{
  "timestamp_CT": "2025-10-30T11:18:17-0500",
  "hb.charter.integrity.status": "GREEN",
  "hb.execution.multi_agent.status": "GREEN",
  "hb.reports.aggregate.status": "GREEN",
  "hb.reflexive.equilibrium.status": "GREEN",
  "hb.system.agent_registry.status": "GREEN",
  "hb.vault.seals.integrity": "verified",
  "hb.codex.sync.state": "synchronized"
}
